{
  "patient_id":"SYN-A02","display_name":"Fictional Patient Birch","scenario_reference_time":"relative-to-session-anchor",
  "demographics":{"age_display":"58 years","age_years":58,"population":"adult","weight_kg":74,"weight_provenance":"measured","code_status":"Full code"},"suggested_workflow":"cardiac_arrest",
  "domains":{
    "encounters":{"availability":"available","records":[{"source_id":"A02-ENC-1","observed_offset_days":-18,"available_offset_days":-18,"finding":{"visit_type":"Ambulatory","summary":"Dialysis follow-up; one treatment missed."}},{"source_id":"A02-ENC-2","observed_offset_days":-4,"available_offset_days":-4,"finding":{"visit_type":"Telephone","summary":"Telephone note documents missed dialysis session."}}]},
    "problems":{"availability":"available","records":[{"source_id":"A02-PRB-1","observed_offset_days":-1200,"available_offset_days":-1200,"ongoing":true,"finding":{"problem":"End-stage kidney disease","status":"active"}},{"source_id":"A02-PRB-2","observed_offset_days":-800,"available_offset_days":-800,"ongoing":true,"finding":{"problem":"Hypertension","status":"active"}}]},
    "medications":{"availability":"available","records":[{"source_id":"A02-MED-1","observed_offset_days":-8,"available_offset_days":-8,"ongoing":true,"finding":{"name":"sevelamer","status":"active"}}]},
    "allergies":{"availability":"available","records":[{"source_id":"A02-ALG-1","observed_offset_days":-700,"available_offset_days":-700,"ongoing":true,"finding":{"substance":"penicillin","reaction":"rash","status":"active"}}]},
    "weights":{"availability":"available","records":[{"source_id":"A02-WGT-1","observed_offset_days":-60,"available_offset_days":-60,"ongoing":true,"finding":{"kg":74,"provenance":"measured"}}]},
    "code_status":{"availability":"available","records":[{"source_id":"A02-CODE-1","observed_offset_days":-90,"available_offset_days":-90,"ongoing":true,"finding":{"status":"full code","source":"simulation chart"}}]},
    "vitals":{"availability":"available","records":[{"source_id":"A02-VIT-1","observed_offset_days":-4,"available_offset_days":-4,"finding":{"blood_pressure":"158/92 mmHg","context":"pre-dialysis clinic"}}]},
    "labs":{"availability":"available","records":[{"source_id":"A02-LAB-1","observed_offset_days":-4,"available_offset_days":-3,"finding":{"test":"potassium","value":6.1,"units":"mmol/L","reference_range":"3.5-5.1","note":"Dated pre-arrest; not a current arrest measurement."}},{"source_id":"A02-LAB-2","observed_offset_days":-18,"available_offset_days":-18,"finding":{"test":"bicarbonate","value":19,"units":"mmol/L"}}]},
    "procedures":{"availability":"available","records":[{"source_id":"A02-PROC-1","observed_offset_days":-18,"available_offset_days":-18,"finding":{"procedure":"hemodialysis","status":"routine outpatient treatment"}}]},
    "imaging":{"availability":"empty","records":[]},"ecg":{"availability":"available","records":[{"source_id":"A02-ECG-1","observed_offset_days":-18,"available_offset_days":-18,"finding":{"report":"Sinus rhythm; no acute interpretation provided."}}]},
    "notes":{"availability":"available","records":[{"source_id":"A02-NOTE-1","observed_offset_days":-4,"available_offset_days":-4,"finding":{"text":"Patient reports missing the last scheduled dialysis treatment."}}]}
  }
}
