{
  "patient_id":"SYN-A04","display_name":"Fictional Patient Dogwood","scenario_reference_time":"relative-to-session-anchor",
  "demographics":{"age_display":"76 years","age_years":76,"population":"adult","weight_kg":68,"weight_provenance":"historical","code_status":"Full code"},"suggested_workflow":"bradycardia_with_pulse",
  "domains":{
    "encounters":{"availability":"available","records":[{"source_id":"A04-ENC-1","observed_offset_days":-28,"available_offset_days":-28,"finding":{"summary":"Clinic evaluation for fatigue and dizziness."}}]},
    "problems":{"availability":"available","records":[{"source_id":"A04-PRB-1","observed_offset_days":-1200,"available_offset_days":-1200,"ongoing":true,"finding":{"problem":"Conduction disease","status":"active"}},{"source_id":"A04-PRB-2","observed_offset_days":-70,"available_offset_days":-70,"ongoing":true,"finding":{"problem":"Chronic kidney disease","status":"active"}}]},
    "medications":{"availability":"available","records":[{"source_id":"A04-MED-1","observed_offset_days":-6,"available_offset_days":-6,"ongoing":true,"finding":{"name":"metoprolol","status":"active","dose":"25 mg twice daily"}},{"source_id":"A04-MED-2","observed_offset_days":-6,"available_offset_days":-6,"ongoing":true,"finding":{"name":"lisinopril","status":"active"}}]},
    "allergies":{"availability":"empty","records":[]},"weights":{"availability":"available","records":[{"source_id":"A04-WGT-1","observed_offset_days":-250,"available_offset_days":-250,"ongoing":true,"finding":{"kg":68,"provenance":"historical","note":"Older measurement; confirm at session preparation."}}]},
    "code_status":{"availability":"available","records":[{"source_id":"A04-CODE-1","observed_offset_days":-80,"available_offset_days":-80,"ongoing":true,"finding":{"status":"full code","source":"simulation chart"}}]},
    "vitals":{"availability":"available","records":[{"source_id":"A04-VIT-1","observed_offset_days":-28,"available_offset_days":-28,"finding":{"heart_rate_bpm":48,"blood_pressure":"98/60 mmHg","symptoms":"fatigue and dizziness"}}]},
    "labs":{"availability":"available","records":[{"source_id":"A04-LAB-1","observed_offset_days":-28,"available_offset_days":-28,"finding":{"test":"creatinine","value":1.9,"units":"mg/dL","context":"historical clinic result"}}]},
    "procedures":{"availability":"available","records":[{"source_id":"A04-PROC-1","observed_offset_days":-700,"available_offset_days":-700,"finding":{"procedure":"ambulatory rhythm monitoring","result":"intermittent conduction delay reported"}}]},
    "imaging":{"availability":"empty","records":[]},"ecg":{"availability":"available","records":[{"source_id":"A04-ECG-1","observed_offset_days":-28,"available_offset_days":-28,"finding":{"report":"Sinus bradycardia with first-degree AV block reported."}}]},
    "notes":{"availability":"available","records":[{"source_id":"A04-NOTE-1","observed_offset_days":-28,"available_offset_days":-28,"finding":{"text":"Medication review requested due to dizziness and low resting heart rate."}}]}
  }
}
