{
  "patient_id": "SYN-A01", "display_name": "Fictional Patient Alder", "scenario_reference_time": "relative-to-session-anchor",
  "demographics": {"age_display": "64 years", "age_years": 64, "population": "adult", "weight_kg": 86, "weight_provenance": "measured", "code_status": "Full code; latest synthetic record"},
  "suggested_workflow": "cardiac_arrest",
  "domains": {
    "encounters": {"availability": "available", "records": [{"source_id":"A01-ENC-1","observed_offset_days":-42,"available_offset_days":-42,"finding":{"visit_type":"Inpatient","summary":"Cardiology admission for coronary artery disease."}},{"source_id":"A01-ENC-2","observed_offset_days":-12,"available_offset_days":-12,"finding":{"visit_type":"Ambulatory","summary":"Urgent visit for chest discomfort; no acute diagnosis recorded."}}]},
    "problems": {"availability":"available","records":[{"source_id":"A01-PRB-1","observed_offset_days":-900,"available_offset_days":-900,"ongoing":true,"finding":{"problem":"Coronary artery disease","status":"active"}},{"source_id":"A01-PRB-2","observed_offset_days":-500,"available_offset_days":-500,"ongoing":true,"finding":{"problem":"Hypertension","status":"active"}}]},
    "medications": {"availability":"available","records":[{"source_id":"A01-MED-1","observed_offset_days":-3,"available_offset_days":-3,"ongoing":true,"finding":{"name":"atorvastatin","status":"active","dose":"40 mg daily"}},{"source_id":"A01-MED-2","observed_offset_days":-3,"available_offset_days":-3,"ongoing":true,"finding":{"name":"aspirin","status":"active","dose":"81 mg daily"}}]},
    "allergies":{"availability":"empty","records":[]},
    "weights":{"availability":"available","records":[{"source_id":"A01-WGT-1","observed_offset_days":-14,"available_offset_days":-14,"ongoing":true,"finding":{"kg":86,"provenance":"measured"}}]},
    "code_status":{"availability":"available","records":[{"source_id":"A01-CODE-1","observed_offset_days":-20,"available_offset_days":-20,"ongoing":true,"finding":{"status":"full code","source":"simulation chart"}}]},
    "vitals":{"availability":"available","records":[{"source_id":"A01-VIT-1","observed_offset_days":-12,"available_offset_days":-12,"finding":{"heart_rate_bpm":84,"context":"chest discomfort visit"}}]},
    "labs":{"availability":"available","records":[{"source_id":"A01-LAB-1","observed_offset_days":-42,"available_offset_days":-41,"finding":{"test":"troponin","value":"within reference range","units":"ng/L","context":"prior admission"}}]},
    "procedures":{"availability":"available","records":[{"source_id":"A01-PROC-1","observed_offset_days":-42,"available_offset_days":-42,"finding":{"procedure":"coronary angiography report reviewed","result":"non-obstructive disease documented"}}]},
    "imaging":{"availability":"empty","records":[]},
    "ecg":{"availability":"available","records":[{"source_id":"A01-ECG-1","observed_offset_days":-12,"available_offset_days":-12,"finding":{"report":"Sinus rhythm; nonspecific ST-T changes reported."}}]},
    "notes":{"availability":"available","records":[{"source_id":"A01-NOTE-1","observed_offset_days":-12,"available_offset_days":-12,"finding":{"text":"Intermittent chest pressure; outpatient follow-up planned."}}]}
  }
}
