{
  "patient_id":"SYN-A03","display_name":"Fictional Patient Cedar","scenario_reference_time":"relative-to-session-anchor",
  "demographics":{"age_display":"47 years","age_years":47,"population":"adult","weight_kg":92,"weight_provenance":"measured","code_status":"Full code"},"suggested_workflow":"cardiac_arrest",
  "domains":{
    "encounters":{"availability":"available","records":[{"source_id":"A03-ENC-1","observed_offset_days":-35,"available_offset_days":-34,"finding":{"summary":"Recent orthopedic surgery admission."}},{"source_id":"A03-ENC-2","observed_offset_days":-22,"available_offset_days":-22,"finding":{"summary":"Postoperative follow-up; reduced mobility documented."}}]},
    "problems":{"availability":"available","records":[{"source_id":"A03-PRB-1","observed_offset_days":-1500,"available_offset_days":-1500,"ongoing":true,"finding":{"problem":"Prior venous thromboembolism","status":"history"}},{"source_id":"A03-PRB-2","observed_offset_days":-35,"available_offset_days":-35,"ongoing":true,"finding":{"problem":"Recent lower-extremity surgery","status":"active"}}]},
    "medications":{"availability":"available","records":[{"source_id":"A03-MED-1","observed_offset_days":-20,"available_offset_days":-20,"ongoing":true,"finding":{"name":"apixaban","status":"active","note":"Postoperative medication list; adherence not established."}}]},
    "allergies":{"availability":"empty","records":[]},"weights":{"availability":"available","records":[{"source_id":"A03-WGT-1","observed_offset_days":-22,"available_offset_days":-22,"ongoing":true,"finding":{"kg":92,"provenance":"measured"}}]},
    "code_status":{"availability":"available","records":[{"source_id":"A03-CODE-1","observed_offset_days":-35,"available_offset_days":-35,"ongoing":true,"finding":{"status":"full code","source":"simulation chart"}}]},
    "vitals":{"availability":"available","records":[{"source_id":"A03-VIT-1","observed_offset_days":-22,"available_offset_days":-22,"finding":{"heart_rate_bpm":102,"context":"postoperative follow-up"}}]},
    "labs":{"availability":"available","records":[{"source_id":"A03-LAB-1","observed_offset_days":-35,"available_offset_days":-35,"finding":{"test":"hemoglobin","value":11.8,"units":"g/dL"}}]},
    "procedures":{"availability":"available","records":[{"source_id":"A03-PROC-1","observed_offset_days":-35,"available_offset_days":-35,"finding":{"procedure":"knee arthroplasty","context":"recent surgery"}}]},
    "imaging":{"availability":"unavailable","records":[]},"ecg":{"availability":"empty","records":[]},
    "notes":{"availability":"available","records":[{"source_id":"A03-NOTE-1","observed_offset_days":-22,"available_offset_days":-22,"finding":{"text":"Mobility reduced since operation; prior venous thromboembolism listed in history."}}]}
  }
}
